{
  "schema_version": "1.0",
  "estimate_id": "10000000-0000-4000-8000-000000000001",
  "run_id": "20000000-0000-4000-8000-000000000001",
  "metric_spec": {
    "metric_id": "behavior.mean_reward",
    "metric_version": "1.0",
    "canonical_sha256": "c61b496da6e23b4722f1b2cb6097faa30857ec95815bac6120a2564f54351b09"
  },
  "population": {
    "population_id": "authorized_transitions",
    "eligible_count": 100,
    "observed_count": 100,
    "selection_sha256": "44136fa355b3678a1146ad16f7e8649e94fb4fc21fe77e8310c060f61caaff8a"
  },
  "window": {"basis": "step_count", "start": 0, "end": 100},
  "result": {"kind": "scalar", "value": 0.25, "unit": "reward_unit_id", "availability": "measured"},
  "estimator": {"estimator_id": "arithmetic_mean", "estimator_version": "1.0", "parameters_sha256": "44136fa355b3678a1146ad16f7e8649e94fb4fc21fe77e8310c060f61caaff8a"},
  "missingness": {"missing_count": 0, "invalid_count": 0, "coverage_ratio": 1.0, "disposition": "complete", "reason_codes": []},
  "precision": {"representation": "finite_binary64", "significant_bits": 53, "absolute_tolerance": 0.0, "relative_tolerance": 0.0},
  "uncertainty_ids": ["30000000-0000-4000-8000-000000000001"],
  "inputs": [
    {"evidence_id": "event-segment-0001", "evidence_type": "event", "sha256": "6d4e776a41e0f13817f6eb91e5d7aaa218cd672bdf88ff41cfac285331520aeb", "role": "reward observations"}
  ]
}
